{
  "registry_version": "H1-TRACK-REGISTRY-1.0.0",
  "contract_version": "H1-MEASUREMENT-1.0.0",
  "historical_start": "2022-01-01",
  "created_at": "2026-08-28T03:15:00+09:00",
  "outcome_neutral": true,
  "tracks": [
    {
      "track_id": "P01-SKH-HBM3",
      "track_type": "PRODUCT_COMMERCIALIZATION_TRACK",
      "entity": "SK hynix",
      "product": "HBM3",
      "platform": null,
      "generation": "HBM3",
      "geography": null,
      "start_boundary": "2022-01-01",
      "inclusion_reason": "Official supplier-generation disclosure exists within the approved period.",
      "first_known_candidate_source_family": "SK hynix official HBM3 product release",
      "left_truncated": true,
      "right_censoring_risk": false,
      "expected_source_families": ["supplier product release", "supplier IR/earnings", "official counterparty platform release"],
      "known_scope_limitation": "Development and sampling began before the boundary; no CSP-instance supplier identity is established.",
      "registry_status": "PRE_REGISTERED",
      "status_reason": null
    },
    {
      "track_id": "P02-SKH-HBM3E",
      "track_type": "PRODUCT_COMMERCIALIZATION_TRACK",
      "entity": "SK hynix",
      "product": "HBM3E 8H/12H",
      "platform": null,
      "generation": "HBM3E",
      "geography": null,
      "start_boundary": "2022-01-01",
      "inclusion_reason": "Official product-generation disclosure exists within the approved period.",
      "first_known_candidate_source_family": "SK hynix official HBM3E product release",
      "left_truncated": false,
      "right_censoring_risk": false,
      "expected_source_families": ["supplier product release", "supplier IR/earnings"],
      "known_scope_limitation": "Customers are generally unnamed and the official archive is announcement-biased.",
      "registry_status": "PRE_REGISTERED",
      "status_reason": null
    },
    {
      "track_id": "P03-SEC-HBM3E",
      "track_type": "PRODUCT_COMMERCIALIZATION_TRACK",
      "entity": "Samsung Electronics",
      "product": "HBM3E 8H/12H",
      "platform": null,
      "generation": "HBM3E",
      "geography": null,
      "start_boundary": "2022-01-01",
      "inclusion_reason": "Official product-generation and sampling disclosure exists within the approved period.",
      "first_known_candidate_source_family": "Samsung official HBM3E newsroom release",
      "left_truncated": false,
      "right_censoring_risk": false,
      "expected_source_families": ["supplier newsroom", "DART filing", "supplier earnings"],
      "known_scope_limitation": "Stage language is inconsistent and strict customer-supply wording may not be public.",
      "registry_status": "PRE_REGISTERED",
      "status_reason": null
    },
    {
      "track_id": "P04-MU-HBM3E",
      "track_type": "PRODUCT_COMMERCIALIZATION_TRACK",
      "entity": "Micron",
      "product": "HBM3E 8H/12H",
      "platform": null,
      "generation": "HBM3E",
      "geography": null,
      "start_boundary": "2022-01-01",
      "inclusion_reason": "Official qualification and product disclosures exist within the approved period.",
      "first_known_candidate_source_family": "Micron SEC exhibit and IR HBM3E release",
      "left_truncated": false,
      "right_censoring_risk": false,
      "expected_source_families": ["SEC filing exhibit", "supplier IR release", "official platform-family release"],
      "known_scope_limitation": "The H200 family link does not establish the supplier in any specific CSP instance.",
      "registry_status": "PRE_REGISTERED",
      "status_reason": null
    },
    {
      "track_id": "P05-SKH-HBM4",
      "track_type": "PRODUCT_COMMERCIALIZATION_TRACK",
      "entity": "SK hynix",
      "product": "HBM4 12H",
      "platform": null,
      "generation": "HBM4",
      "geography": null,
      "start_boundary": "2022-01-01",
      "inclusion_reason": "Official HBM4 sampling disclosure exists within the approved period.",
      "first_known_candidate_source_family": "SK hynix official HBM4 sample release",
      "left_truncated": false,
      "right_censoring_risk": true,
      "expected_source_families": ["supplier product release", "supplier IR/earnings"],
      "known_scope_limitation": "Customer qualification, volume, price, and share are not publicly established.",
      "registry_status": "PRE_REGISTERED",
      "status_reason": null
    },
    {
      "track_id": "P06-SEC-HBM4",
      "track_type": "PRODUCT_COMMERCIALIZATION_TRACK",
      "entity": "Samsung Electronics",
      "product": "HBM4",
      "platform": null,
      "generation": "HBM4",
      "geography": null,
      "start_boundary": "2022-01-01",
      "inclusion_reason": "Official HBM4 generation disclosure exists within the approved period.",
      "first_known_candidate_source_family": "Samsung official newsroom and DART HBM4 disclosures",
      "left_truncated": false,
      "right_censoring_risk": true,
      "expected_source_families": ["supplier newsroom", "DART filing", "supplier earnings", "official counterparty release"],
      "known_scope_limitation": "The early source chain and exact stage wording require archive verification.",
      "registry_status": "PRE_REGISTERED",
      "status_reason": null
    },
    {
      "track_id": "P07-MU-HBM4",
      "track_type": "PRODUCT_COMMERCIALIZATION_TRACK",
      "entity": "Micron",
      "product": "HBM4 12H",
      "platform": null,
      "generation": "HBM4",
      "geography": null,
      "start_boundary": "2022-01-01",
      "inclusion_reason": "Official HBM4 sample and product disclosure exists within the approved period.",
      "first_known_candidate_source_family": "Micron SEC exhibit and IR HBM4 release",
      "left_truncated": false,
      "right_censoring_risk": true,
      "expected_source_families": ["SEC filing exhibit", "supplier IR material"],
      "known_scope_limitation": "Recent disclosures may be censored and contracts may be HBM-family rather than generation-specific.",
      "registry_status": "PRE_REGISTERED",
      "status_reason": null
    },
    {
      "track_id": "P08-SKH-HBM4E",
      "track_type": "PRODUCT_COMMERCIALIZATION_TRACK",
      "entity": "SK hynix",
      "product": "HBM4E 12H",
      "platform": null,
      "generation": "HBM4E",
      "geography": null,
      "start_boundary": "2022-01-01",
      "inclusion_reason": "Official HBM4E sample disclosure exists before the registry freeze.",
      "first_known_candidate_source_family": "SK hynix official HBM4E sample release",
      "left_truncated": false,
      "right_censoring_risk": true,
      "expected_source_families": ["supplier product release", "supplier IR/earnings"],
      "known_scope_limitation": "The Track is too recent for the approved observation windows at registry freeze.",
      "registry_status": "PRE_REGISTERED",
      "status_reason": null
    },
    {
      "track_id": "P09-SEC-HBM4E",
      "track_type": "PRODUCT_COMMERCIALIZATION_TRACK",
      "entity": "Samsung Electronics",
      "product": "HBM4E 12H",
      "platform": null,
      "generation": "HBM4E",
      "geography": null,
      "start_boundary": "2022-01-01",
      "inclusion_reason": "Official HBM4E sample disclosure exists before the registry freeze.",
      "first_known_candidate_source_family": "Samsung official HBM4E newsroom release",
      "left_truncated": false,
      "right_censoring_risk": true,
      "expected_source_families": ["supplier newsroom", "DART filing", "supplier earnings"],
      "known_scope_limitation": "The Track is recent and customer, platform, and downstream stages are not established.",
      "registry_status": "PRE_REGISTERED",
      "status_reason": null
    },
    {
      "track_id": "P10-MU-HBM4E",
      "track_type": "PRODUCT_COMMERCIALIZATION_TRACK",
      "entity": "Micron",
      "product": "HBM4E",
      "platform": null,
      "generation": "HBM4E",
      "geography": null,
      "start_boundary": "2022-01-01",
      "inclusion_reason": "Official HBM4E development disclosure exists before the registry freeze.",
      "first_known_candidate_source_family": "Micron SEC exhibit and IR HBM4E disclosure",
      "left_truncated": false,
      "right_censoring_risk": true,
      "expected_source_families": ["SEC filing exhibit", "supplier IR material"],
      "known_scope_limitation": "Development is not sampling and downstream stages are not publicly available.",
      "registry_status": "PRE_REGISTERED",
      "status_reason": null
    },
    {
      "track_id": "C01-AZ-H100",
      "track_type": "CUSTOMER_PLATFORM_REALIZATION_TRACK",
      "entity": "Microsoft Azure",
      "product": null,
      "platform": "ND H100 v5",
      "generation": "H100",
      "geography": null,
      "start_boundary": "2022-01-01",
      "inclusion_reason": "A reporting CSP disclosed a named H100 cloud SKU.",
      "first_known_candidate_source_family": "Microsoft earnings and Azure H100 release",
      "left_truncated": false,
      "right_censoring_risk": false,
      "expected_source_families": ["SEC filing", "official earnings", "Azure product release"],
      "known_scope_limitation": "Broad Microsoft CAPEX cannot be allocated to this SKU.",
      "registry_status": "PRE_REGISTERED",
      "status_reason": null
    },
    {
      "track_id": "C02-AZ-H200",
      "track_type": "CUSTOMER_PLATFORM_REALIZATION_TRACK",
      "entity": "Microsoft Azure",
      "product": null,
      "platform": "ND H200 v5",
      "generation": "H200",
      "geography": null,
      "start_boundary": "2022-01-01",
      "inclusion_reason": "A separately announced H200 cloud SKU exists in the approved universe.",
      "first_known_candidate_source_family": "Microsoft earnings and Azure ND H200 v5 release",
      "left_truncated": false,
      "right_censoring_risk": false,
      "expected_source_families": ["SEC filing", "official earnings", "Azure product release"],